[
  { "id": "pull-up-max", "name": "Max strict pull-ups", "exerciseId": "pull-up", "metric": "reps", "protocol": "One max-effort set from a dead hang, chin over the bar and full lockout each rep, no kipping; this is a max test, so go until form breaks. Warm up first and rest 3 min after.", "scheduledWeeks": [1, 4, 8, 12], "higherIsBetter": true },
  { "id": "band-assisted-pull-up-max", "name": "Max band-assisted pull-ups", "exerciseId": "band-assisted-pull-up", "metric": "reps", "protocol": "Only if pull-up-max is 0: one max-effort set of strict band-assisted pull-ups, logging the band used; go until form breaks. Rest 3 min before the next test.", "scheduledWeeks": [1, 4, 8, 12], "higherIsBetter": true },
  { "id": "push-up-max", "name": "Max full push-ups", "exerciseId": "full-push-up", "metric": "reps", "protocol": "One max-effort set, chest to fist height, body in one straight line, full lockout; this is a max test, so go until form breaks. Rest 3 min after.", "scheduledWeeks": [1, 4, 8, 12], "higherIsBetter": true },
  { "id": "incline-push-up-max", "name": "Max incline push-ups", "exerciseId": "incline-push-up", "metric": "reps", "protocol": "Only if push-up-max is under 3: one max-effort set of strict incline push-ups, logging the incline height; go until form breaks. Rest 3 min after.", "scheduledWeeks": [1, 4, 8, 12], "higherIsBetter": true },
  { "id": "dip-max", "name": "Max dips", "exerciseId": "dip", "metric": "reps", "protocol": "One max-effort set on the dip station, shoulders to elbow height and full lockout, no kicking; go until form breaks. Rest 3 min after.", "scheduledWeeks": [1, 4, 8, 12], "higherIsBetter": true },
  { "id": "dip-support-hold", "name": "Dip support hold", "exerciseId": "dip-support-hold", "metric": "seconds", "protocol": "Only if dip-max is 0: hold the top support with locked elbows and shoulders pressed down as long as form holds; this is a max effort. Best of 2 attempts, 2 min rest between.", "scheduledWeeks": [1, 4, 8, 12], "higherIsBetter": true },
  { "id": "chest-to-wall-handstand-hold", "name": "Chest-to-wall handstand hold", "exerciseId": "chest-to-wall-handstand-hold", "metric": "seconds", "protocol": "After wrist prep, walk into a chest-to-wall handstand and hold with straight arms, ribs down and shoulders open until form breaks; this is a max effort. Best of 2 attempts, 2 min rest between.", "scheduledWeeks": [1, 4, 8, 12], "higherIsBetter": true },
  { "id": "l-sit-hold", "name": "L-sit hold", "exerciseId": "l-sit", "metric": "seconds", "protocol": "On the dip-station handles, hold a full L-sit with straight legs at hip height and shoulders pressed down until form breaks; this is a max effort. Best of 2 attempts, 2 min rest between.", "scheduledWeeks": [1, 4, 8, 12], "higherIsBetter": true },
  { "id": "tuck-l-sit-hold", "name": "Tuck L-sit hold", "exerciseId": "tuck-l-sit", "metric": "seconds", "protocol": "Only if l-sit-hold is under 5 s: hold a tuck L-sit on the dip-station handles until form breaks; this is a max effort. Best of 2 attempts, 2 min rest between.", "scheduledWeeks": [1, 4, 8, 12], "higherIsBetter": true },
  { "id": "pistol-left", "name": "Pistol squat, left leg", "exerciseId": "pistol-squat", "metric": "pass_fail", "protocol": "Pass is one controlled full-depth pistol on the left leg with the heel down; log the assistance level used (none, TRX, or box height) whether pass or fail. Up to 3 attempts, 1 min rest between.", "scheduledWeeks": [1, 4, 8, 12], "higherIsBetter": true },
  { "id": "pistol-right", "name": "Pistol squat, right leg", "exerciseId": "pistol-squat", "metric": "pass_fail", "protocol": "Pass is one controlled full-depth pistol on the right leg with the heel down; log the assistance level used (none, TRX, or box height) whether pass or fail. Up to 3 attempts, 1 min rest between.", "scheduledWeeks": [1, 4, 8, 12], "higherIsBetter": true },
  { "id": "hollow-hold", "name": "Hollow hold", "exerciseId": "hollow-hold", "metric": "seconds", "protocol": "Hold a hollow body with lower back pressed to the floor, arms overhead and legs low, until the back lifts; this is a max effort. Best of 2 attempts, 2 min rest between.", "scheduledWeeks": [1, 4, 8, 12], "higherIsBetter": true },
  { "id": "hanging-leg-raise-max", "name": "Max hanging leg raises", "exerciseId": "hanging-leg-raise", "metric": "reps", "protocol": "One max-effort set of straight-leg raises to hip height or above from an active hang, no swinging; go until form breaks. Rest 2 min after.", "scheduledWeeks": [1, 4, 8, 12], "higherIsBetter": true },
  { "id": "front-split-left", "name": "Front split, left leg forward", "exerciseId": "front-split-passive", "metric": "cm_from_floor", "protocol": "After a warm-up, sink into a square-hipped front split with the left leg forward and measure the gap from the floor to the front of the pelvis; work at a strong stretch, not pain. Best of 2 attempts, 1 min between.", "scheduledWeeks": [1, 4, 8, 12], "higherIsBetter": false },
  { "id": "front-split-right", "name": "Front split, right leg forward", "exerciseId": "front-split-passive", "metric": "cm_from_floor", "protocol": "After a warm-up, sink into a square-hipped front split with the right leg forward and measure the gap from the floor to the front of the pelvis; work at a strong stretch, not pain. Best of 2 attempts, 1 min between.", "scheduledWeeks": [1, 4, 8, 12], "higherIsBetter": false },
  { "id": "middle-split", "name": "Middle split", "exerciseId": "middle-split-passive", "metric": "cm_from_floor", "protocol": "After a warm-up, slide into a middle split with knees pointing up and measure the gap from the floor to the pelvis; work at a strong stretch, not pain. Best of 2 attempts, 1 min between.", "scheduledWeeks": [1, 4, 8, 12], "higherIsBetter": false },
  { "id": "pancake-chest-to-floor", "name": "Pancake chest to floor", "exerciseId": "pancake-passive", "metric": "cm_from_floor", "protocol": "Seated with legs wide and knees up, fold forward from the hips with a long spine and measure the gap from the floor to the chest; work at a strong stretch, not pain. Best of 2 attempts, 1 min between.", "scheduledWeeks": [1, 4, 8, 12], "higherIsBetter": false },
  { "id": "bridge", "name": "Bridge", "exerciseId": "bridge", "metric": "pass_fail", "protocol": "Pass is a 10 s hold with straight arms in the hardest variant achieved (table top, wall walk-down, full bridge or handstand to bridge); log the variant name. Up to 2 attempts, 2 min rest between.", "scheduledWeeks": [1, 4, 8, 12], "higherIsBetter": true },
  { "id": "planche-lean-hold", "name": "Planche lean hold", "exerciseId": "planche-lean", "metric": "seconds", "protocol": "After wrist prep, hold a planche lean with locked elbows, protracted shoulders and the shoulders ahead of the hands, logging the lean depth, until form breaks; this is a max effort. Best of 2 attempts, 2 min rest between.", "scheduledWeeks": [1, 4, 8, 12], "higherIsBetter": true },
  { "id": "tuck-front-lever-hold", "name": "Tuck front lever hold", "exerciseId": "tuck-front-lever", "metric": "seconds", "protocol": "Hold a tuck front lever with straight arms and hips level with the shoulders until form breaks; this is a max effort. Best of 2 attempts, 2 min rest between.", "scheduledWeeks": [1, 4, 8, 12], "higherIsBetter": true },
  { "id": "german-hang-hold", "name": "German hang hold", "exerciseId": "german-hang", "metric": "seconds", "protocol": "Enter the German hang slowly from a tuck and hold at a comfortable shoulder stretch until form or comfort breaks, then exit the way you came; max effort but never into pain. Best of 2 attempts, 2 min rest between.", "scheduledWeeks": [1, 4, 8, 12], "higherIsBetter": true },
  { "id": "elevated-pike-push-up-max", "name": "Max elevated pike push-ups", "exerciseId": "elevated-pike-push-up", "metric": "reps", "protocol": "One max-effort set with feet on the box, hips over the shoulders, head to the floor and full lockout, logging the box height; go until form breaks. Rest 3 min after.", "scheduledWeeks": [1, 4, 8, 12], "higherIsBetter": true },
  { "id": "chest-to-bar-pull-up-max", "name": "Max chest-to-bar pull-ups", "exerciseId": "chest-to-bar-pull-up", "metric": "reps", "protocol": "One max-effort set from a dead hang where the chest touches the bar each rep, no kipping; go until form breaks. Rest 3 min after.", "scheduledWeeks": [1, 4, 8, 12], "higherIsBetter": true },
  { "id": "skin-the-cat", "name": "Skin the cat", "exerciseId": "skin-the-cat", "metric": "pass_fail", "protocol": "Pass is one comfortable, controlled skin the cat into German hang and back with no pain or jerking. Up to 2 attempts, 2 min rest between.", "scheduledWeeks": [1, 4, 8, 12], "higherIsBetter": true },
  { "id": "archer-pull-up-max", "name": "Max archer pull-ups", "exerciseId": "archer-pull-up", "metric": "reps", "protocol": "One max-effort set per side with the assisting arm straight, rest 3 min between sides, and log the lower of the two; go until form breaks.", "scheduledWeeks": [1, 4, 8, 12], "higherIsBetter": true },
  { "id": "dragon-flag-negative", "name": "Dragon flag negative", "exerciseId": "dragon-flag-negative", "metric": "pass_fail", "protocol": "Pass is one full dragon flag negative lowered under control over 3-5 s with a straight body and no hip pike. Up to 2 attempts, 2 min rest between.", "scheduledWeeks": [1, 4, 8, 12], "higherIsBetter": true },
  { "id": "active-front-leg-raise-left", "name": "Active front leg raise, left leg", "exerciseId": "standing-front-leg-raise-hold", "metric": "cm_height", "protocol": "After a warm-up, stand side-on to the wall and lift the left leg as high as it goes without help, hold 2 s at the top, and mark the heel height on the wall; measure the mark from the floor in cm. Best of 3 attempts, 1 min between.", "scheduledWeeks": [1, 4, 8, 12], "higherIsBetter": true },